{
  "schema_version": 1,
  "artifact_kind": "records-export",
  "export_id": "export-01",
  "policy_id": "conservative-default",
  "policy_sha256": "aaaaaaaaaaaaaaaaaaaaaaaaaaaaaaaaaaaaaaaaaaaaaaaaaaaaaaaaaaaaaaaa",
  "target_root_hash": "bbbbbbbbbbbbbbbbbbbbbbbbbbbbbbbbbbbbbbbbbbbbbbbbbbbbbbbbbbbbbbbb",
  "as_of": "2026-08-22T12:00:00Z",
  "sensitivity": "potentially-sensitive",
  "purpose": "records-lifecycle-export",
  "audience": ["authorized-records-operators"],
  "content_policy": "exact-selected-record-bytes",
  "records": [
    {
      "record_id": "rec_0123456789abcdef0123456789abcdef",
      "artifact_class": "memory",
      "path": ".agent/memory/working/WORKSPACE.md",
      "content_sha256": "cccccccccccccccccccccccccccccccccccccccccccccccccccccccccccccccc",
      "file": "rec_0123456789abcdef0123456789abcdef.bin"
    }
  ]
}
